tweet_id,favorite_count,retweet_count,followers_count,friends_count,retweeted_status,url,text,rating_numerator,rating_denominator,name,doggo,floofer,pupper,puppo,year,month,day
676864501615042560,2232,781,6831414,103,Original tweet,https://t.co/NJj2uP0atK,Meet Ash. He's just a head now. Lost his body during the Third Crusade. Still in good spirits. 10/10 would pet well https://t.co/NJj2uP0atK,10.0,10.0,Ash,False,False,False,False,2015,12,15
676821958043033607,24493,17028,6831414,103,Original tweet,https://t.co/mvQaETHVSb,Finally some constructive political change in this country. 11/10 https://t.co/mvQaETHVSb,11.0,10.0,None,False,False,False,False,2015,12,15
676819651066732545,1909,721,6831414,103,Original tweet,https://t.co/1HrFdo7M0C,Watch out Airbud. This pupper is also good at the sports. 12/10 I'm thinking D1 https://t.co/1HrFdo7M0C,12.0,10.0,None,False,False,True,False,2015,12,15
676811746707918848,1502,459,6831414,103,Original tweet,https://t.co/aqBHjjh5VD,Say hello to Penny &amp; Gizmo. They are practicing their caroling. The ambition in the room is tangible. 9/10 for both https://t.co/aqBHjjh5VD,9.0,10.0,Penny,False,False,False,False,2015,12,15
676776431406465024,5280,2186,6831414,103,Original tweet,https://t.co/4rMZi5Ca1k,"When someone yells ""cops!"" at a party and you gotta get your drunk friend out of there. 10/10 https://t.co/4rMZi5Ca1k",10.0,10.0,None,False,False,False,False,2015,12,15
676617503762681856,3064,1071,6831415,103,Original tweet,https://t.co/mpQl2rJjDh,I promise this wasn't meant to be a cuteness overload account but ermergerd look at this cozy pupper. 13/10 https://t.co/mpQl2rJjDh,13.0,10.0,None,False,False,True,False,2015,12,15
676613908052996102,1151,210,6831415,103,Original tweet,https://t.co/vQ2Lw1BLBF,This is the saddest/sweetest/best picture I've been sent. 12/10 ðŸ˜¢ðŸ¶ https://t.co/vQ2Lw1BLBF,12.0,10.0,the,False,False,False,False,2015,12,15
676606785097199616,1991,478,6831415,103,Original tweet,https://t.co/N5QL4ySBEx,*screeches for a sec and then faints* 12/10 https://t.co/N5QL4ySBEx,12.0,10.0,None,False,False,False,False,2015,12,15
676603393314578432,1237,426,6831415,103,Original tweet,https://t.co/g1tLGkyaxr,This is Godzilla pupper. He had a ruff childhood &amp; now deflects that pain outward by terrorizing cities. Tragic 9/10 https://t.co/g1tLGkyaxr,9.0,10.0,Godzilla,False,False,True,False,2015,12,15
676593408224403456,4840,2344,6831415,103,Original tweet,https://t.co/APvLqbEhkF,This pupper loves leaves. 11/10 for committed leaf lover https://t.co/APvLqbEhkF,11.0,10.0,None,False,False,True,False,2015,12,15
676590572941893632,976,139,6831415,103,Original tweet,u,After some outrage from the crowd. Bubbles is being upgraded to a 7/10. That's as high as I'm going. Thank you,7.0,10.0,None,False,False,False,False,2015,12,15
676588346097852417,2471,865,6831415,103,Original tweet,https://t.co/Nrhvc5tLFT,This is Bubbles. He kinda resembles a fish. Always makes eye contact with u no matter what. Sneaky tongue slip. 5/10 https://t.co/Nrhvc5tLFT,5.0,10.0,Bubbles,False,False,False,False,2015,12,15
676582956622721024,1272,305,6831415,103,Original tweet,https://t.co/vZYtynZZlH,"Meet Vinnie. He's having fun while being safe. Well not a lot of fun, but definitely safe, and that's important 8/10 https://t.co/vZYtynZZlH",8.0,10.0,Vinnie,False,False,False,False,2015,12,15
676575501977128964,2732,1222,6831415,103,Original tweet,https://t.co/NsGyECJuq7,This pupper is very passionate about Christmas. Wanted to give the tree a hug. So cute. 8/10 https://t.co/NsGyECJuq7,8.0,10.0,None,False,False,True,False,2015,12,15
676533798876651520,1982,604,6831415,103,Original tweet,https://t.co/bfw13CnuuZ,ITSOFLUFFAYYYYY 12/10 https://t.co/bfw13CnuuZ,12.0,10.0,None,False,False,False,False,2015,12,14
676496375194980353,1598,580,6831415,103,Original tweet,https://t.co/eoBCjSFajX,Say hello to Griffin. He's upset because his costume for Halloween didn't arrive until today. 9/10 cheer up pup https://t.co/eoBCjSFajX,9.0,10.0,Griffin,False,False,False,False,2015,12,14
676470639084101634,12335,5078,6831415,103,Original tweet,https://t.co/tAmQYvzrau,Three generations of pupper. 11/10 for all https://t.co/tAmQYvzrau,11.0,10.0,None,False,False,True,False,2015,12,14
676440007570247681,1818,728,6831415,103,Original tweet,https://t.co/dB0H9hdZai,Hope your Monday isn't too awful. Here's two baseball puppers. 11/10 for each https://t.co/dB0H9hdZai,11.0,10.0,None,False,False,False,False,2015,12,14
676430933382295552,1475,374,6831415,103,Original tweet,https://t.co/3bim9U5Idr,"Meet Duke. He's an Urban Parmesan. They know he's scared of the green rubber dog. ""Why u do dis?"" thinks Duke. 10/10 https://t.co/3bim9U5Idr",10.0,10.0,Duke,False,False,False,False,2015,12,14
676263575653122048,2185,591,6831415,103,Original tweet,https://t.co/fTgbq1UBR9,All this pupper wanted to do was go skiing. No one told him about the El NiÃ±o. Poor pupper. 10/10 maybe next year https://t.co/fTgbq1UBR9,10.0,10.0,None,False,False,True,False,2015,12,14
676237365392908289,1289,322,6831415,103,Original tweet,https://t.co/dOLQddhXLZ,Say hello to Winston. He has no respect for the system. Much rebellion. I think that's a palm tree... nice. 8/10 https://t.co/dOLQddhXLZ,8.0,10.0,Winston,False,False,False,False,2015,12,14
676219687039057920,79101,33731,6831415,103,Original tweet,https://t.co/uQt37xlYMJ,This is Kenneth. He's stuck in a bubble. 10/10 hang in there Kenneth https://t.co/uQt37xlYMJ,10.0,10.0,Kenneth,False,False,False,False,2015,12,14
676215927814406144,1832,638,6831415,103,Original tweet,https://t.co/tg8h9lzCHv,This is Herm. He just wants to be like the other dogs. Sneaky tongue slip. Super fuzzy. 9/10 would cuddle firmly https://t.co/tg8h9lzCHv,9.0,10.0,Herm,False,False,False,False,2015,12,14
676191832485810177,2402,1112,6831415,103,Original tweet,https://t.co/gwryaJO4tC,These two pups just met and have instantly bonded. Spectacular scene. Mesmerizing af. 10/10 and 7/10 for blue dog https://t.co/gwryaJO4tC,10.0,10.0,None,False,False,False,False,2015,12,14
676146341966438401,2026,724,6831415,103,Original tweet,https://t.co/lmQRrNxaQu,This is Bert. He likes flowers. 10/10 https://t.co/lmQRrNxaQu,10.0,10.0,Bert,False,False,False,False,2015,12,13
676121918416756736,2265,1265,6831415,103,Original tweet,https://t.co/ICNIjSkrXs,Here we are witnessing a very excited dog. Clearly has no control over neck movements. 8/10 would still pet https://t.co/ICNIjSkrXs,8.0,10.0,None,False,False,False,False,2015,12,13
676101918813499392,2964,1251,6831415,103,Original tweet,https://t.co/B3xxSLjQSH,Meet Striker. He's ready for Christmas. 11/10 https://t.co/B3xxSLjQSH,11.0,10.0,Striker,False,False,False,False,2015,12,13
676098748976615425,3187,1562,6831415,103,Original tweet,https://t.co/REyE5YKVBb,Extremely rare pup here. Very religious. Always praying. Too many legs. Not overwhelmingly fluffy. Won't bark. 3/10 https://t.co/REyE5YKVBb,3.0,10.0,None,False,False,False,False,2015,12,13
676089483918516224,1386,464,6831415,103,Original tweet,https://t.co/Cuz0Osnekp,"""Yes hello I'ma just snag this here toasted bagel real quick. carry on."" 9/10 https://t.co/Cuz0Osnekp",9.0,10.0,None,False,False,False,False,2015,12,13
675898130735476737,1731,630,6831415,103,Original tweet,https://t.co/G0pQiFGM7O,I'm sure you've all seen this pupper. Not prepared at all for the flying disc of terror. 10/10 https://t.co/G0pQiFGM7O,10.0,10.0,None,False,False,True,False,2015,12,13
675891555769696257,2248,946,6831415,103,Original tweet,https://t.co/kiW6Knb7Gp,This is Donny. He's summoning the demon monster Babadook. 6/10 Donny please no that won't be a good time for anyone https://t.co/kiW6Knb7Gp,6.0,10.0,Donny,False,False,False,False,2015,12,13
675888385639251968,2514,1037,6831415,103,Original tweet,https://t.co/06oZdehGEa,Breathtaking scene. A father taking care of his newborn pup. Tugs at the heartstrings. 10/10 restores my faith https://t.co/06oZdehGEa,10.0,10.0,None,False,False,False,False,2015,12,13
675878199931371520,4418,1526,6831415,103,Original tweet,https://t.co/sfsVCGIipI,"Ok, I'll admit this is a pretty adorable bunny hopping towards the ocean but please only send in dogs... 11/10 https://t.co/sfsVCGIipI",11.0,10.0,None,False,False,False,False,2015,12,13
675870721063669760,1734,611,6831415,103,Original tweet,https://t.co/QG708dDNH6,&amp; this is Yoshi. Another world record contender 11/10 (what the hell is happening why are there so many contenders?) https://t.co/QG708dDNH6,11.0,10.0,None,False,False,False,False,2015,12,13
675853064436391936,2843,1410,6831415,103,Original tweet,https://t.co/y93p6FLvVw,Here we have an entire platoon of puppers. Total score: 88/80 would pet all at once https://t.co/y93p6FLvVw,88.0,80.0,None,False,False,False,False,2015,12,13
675849018447167488,998,165,6831415,103,Original tweet,u,This dog is being demoted to a 9/10 for not wearing a helmet while riding. Gotta stay safe out there. Thank you,9.0,10.0,None,False,False,False,False,2015,12,13
675845657354215424,2411,966,6831415,103,Original tweet,https://t.co/40dj4eTsXG,"This is Pepper. She's not fully comfortable riding her imaginary bike yet. 10/10 don't worry pupper, it gets easier https://t.co/40dj4eTsXG",10.0,10.0,Pepper,False,False,True,False,2015,12,13
675822767435051008,1606,574,6831415,103,Original tweet,https://t.co/GK2HJtkdQk,ðŸŽ¶ HELLO FROM THE OTHER SIIIIIIIIDE ðŸŽ¶ 10/10s https://t.co/GK2HJtkdQk,10.0,10.0,None,False,False,False,False,2015,12,12
675820929667219457,1107,247,6831416,103,Original tweet,https://t.co/lyXX3v5j4s,Here's a handful of sleepy puppers. All look unaware of their surroundings. Lousy guard dogs. Still cute tho 11/10s https://t.co/lyXX3v5j4s,11.0,10.0,None,False,False,False,False,2015,12,12
675798442703122432,10836,3663,6831416,103,Original tweet,https://t.co/whQKMygnK6,This is Bernie. He just touched a boob for the first time. 10/10 https://t.co/whQKMygnK6,10.0,10.0,Bernie,False,False,False,False,2015,12,12
675781562965868544,1702,513,6831416,103,Original tweet,https://t.co/DVAqAnb624,Say hello to Buddah. He was Waldo for Halloween. 11/10 https://t.co/DVAqAnb624,11.0,10.0,Buddah,False,False,False,False,2015,12,12
675740360753160193,1224,373,6831416,103,Original tweet,https://t.co/AUJi8ujxw9,Here's a pupper licking in slow motion. 12/10 please enjoy https://t.co/AUJi8ujxw9,12.0,10.0,None,False,False,True,False,2015,12,12
675710890956750848,1998,899,6831416,103,Original tweet,https://t.co/JWi6YrpiO1,This is Lenny. He was just told that he couldn't explore the fish tank. 12/10 smh all that work for nothing https://t.co/JWi6YrpiO1,12.0,10.0,Lenny,False,False,False,False,2015,12,12
675707330206547968,2100,746,6831416,103,Original tweet,https://t.co/ALJvbtcwf0,We've got ourselves a battle here. Watch out Reggie. 11/10 https://t.co/ALJvbtcwf0,11.0,10.0,None,False,False,False,False,2015,12,12
675706639471788032,679,103,6831416,103,Original tweet,https://t.co/7E0AiJXPmI,This is a Sizzlin Menorah spaniel from Brooklyn named Wylie. Lovable eyes. Chiller as hell. 10/10 and I'm out.. poof https://t.co/7E0AiJXPmI,10.0,10.0,a,False,False,False,False,2015,12,12
675534494439489536,1904,452,6831416,103,Original tweet,https://t.co/H7kpabTfLj,Seriously guys?! Only send in dogs. I only rate dogs. This is a baby black bear... 11/10 https://t.co/H7kpabTfLj,11.0,10.0,a,False,False,False,False,2015,12,12
675531475945709568,1243,416,6831416,103,Original tweet,https://t.co/c9jmg3Xtzn,This is Ellie AKA Queen Slayer of the Orbs. Very self-motivated. Great yard. Rad foliage. 10/10 would pet diligently https://t.co/c9jmg3Xtzn,10.0,10.0,Ellie,False,False,False,False,2015,12,12
675522403582218240,1093,307,6831416,103,Original tweet,https://t.co/rO2zxf0OQ0,Meet Sammy. He's a Motorola Firefox. Hat under hoodie (must be a half-decent up and coming white rapper) 10/10 https://t.co/rO2zxf0OQ0,10.0,10.0,Sammy,False,False,False,False,2015,12,12
675517828909424640,1378,492,6831416,103,Original tweet,https://t.co/XDiQw4Akiw,12/10 stay woke https://t.co/XDiQw4Akiw,12.0,10.0,None,False,False,False,False,2015,12,12
675501075957489664,18066,6287,6831416,103,Original tweet,https://t.co/WId5lxNdPH,"I shall call him squishy and he shall be mine, and he shall be my squishy. 13/10 https://t.co/WId5lxNdPH",13.0,10.0,None,False,False,False,False,2015,12,12
675497103322386432,3308,1403,6831416,103,Original tweet,https://t.co/h3AWz4AzuC,Meet Reggie. He's going for the world record. Must concentrate. Focus up pup. 11/10 we all believe in you Reggie https://t.co/h3AWz4AzuC,11.0,10.0,Reggie,False,False,False,False,2015,12,12
675489971617296384,1362,645,6831416,103,Original tweet,https://t.co/MnTrKaQ8Wn,RT until we find this dog. Clearly a cool dog (front leg relaxed out window). Looks to be a superb driver. 10/10 https://t.co/MnTrKaQ8Wn,10.0,10.0,None,False,False,False,False,2015,12,12
675483430902214656,1944,1048,6831416,103,Original tweet,https://t.co/C3tlKVq7eO,Rare shielded battle dog here. Very happy about abundance of lettuce. Painfully slow fetcher. Still petable. 5/10 https://t.co/C3tlKVq7eO,5.0,10.0,None,False,False,False,False,2015,12,12
675432746517426176,1596,613,6831416,103,Original tweet,https://t.co/wNkqAED6lG,Happy Friday. Here's some golden puppers. 12/10 for all https://t.co/wNkqAED6lG,12.0,10.0,None,False,False,False,False,2015,12,11
675372240448454658,1799,545,6831416,103,Original tweet,https://t.co/IyAXinfyju,"The tail alone is 13/10. Great dog, better owner https://t.co/IyAXinfyju",13.0,10.0,None,False,False,False,False,2015,12,11
675362609739206656,1102,250,6831416,103,Original tweet,https://t.co/cZlkvgRPdn,This is Daisy. She loves that shoe. Still no seat belt. Super churlish. 12/10 the dogs are killing it today https://t.co/cZlkvgRPdn,12.0,10.0,Daisy,False,False,False,False,2015,12,11
675354435921575936,34472,18484,6831416,103,Original tweet,https://t.co/Bb3xnpsWBC,Everyone needs to watch this. 13/10 https://t.co/Bb3xnpsWBC,13.0,10.0,None,False,False,False,False,2015,12,11
675349384339542016,4143,2445,6831416,103,Original tweet,https://t.co/ZQZf2U4xCP,Yea I lied. Here's more. All 13/10 https://t.co/ZQZf2U4xCP,13.0,10.0,None,False,False,False,False,2015,12,11
675334060156301312,2923,1389,6831416,103,Original tweet,https://t.co/2d68FmWGGs,Good morning here's a grass pupper. 12/10 https://t.co/2d68FmWGGs,12.0,10.0,None,False,False,True,False,2015,12,11
675166823650848770,3808,1744,6831416,103,Original tweet,https://t.co/bijCeHeX4C,This is Arnold. He broke his leg saving a handicapped child from a forest fire. True hero. 10/10 inspirational dog https://t.co/bijCeHeX4C,10.0,10.0,Arnold,False,False,False,False,2015,12,11
675153376133427200,6616,2808,6831416,103,Original tweet,https://t.co/RDXCfk8hK0,What kind of person sends in a picture without a dog in it? 1/10 just because that's a nice table https://t.co/RDXCfk8hK0,1.0,10.0,None,False,False,False,False,2015,12,11
675149409102012420,3934,1816,6831416,103,Original tweet,https://t.co/p6O8X93bTQ,holy shit 12/10 https://t.co/p6O8X93bTQ,12.0,10.0,None,False,False,False,False,2015,12,11
675147105808306176,994,260,6831416,103,Original tweet,https://t.co/f50mbB4UWS,When you're presenting a group project and the 4th guy tells the teacher that he did all the work. 10/10 https://t.co/f50mbB4UWS,10.0,10.0,None,False,False,False,False,2015,12,11
675146535592706048,1255,338,6831416,103,Original tweet,https://t.co/Uz52oYnHzF,This is Coops. He's yelling at the carpet. Not very productive Coops. 7/10 https://t.co/Uz52oYnHzF,7.0,10.0,Coops,False,False,False,False,2015,12,11
675145476954566656,2242,967,6831416,103,Original tweet,https://t.co/YDgstgIDGs,What an honor. 3 dogs here. Blond one is clearly a gymnast. Other two just confused. Very nifty pups. 9/10 for all https://t.co/YDgstgIDGs,9.0,10.0,None,False,False,False,False,2015,12,11
675135153782571009,1362,529,6831416,103,Original tweet,https://t.co/zf7Sxxjfp3,This is Steven. He got locked outside. Damn it Steven. 5/10 nice grill tho https://t.co/zf7Sxxjfp3,5.0,10.0,Steven,False,False,False,False,2015,12,11
675113801096802304,2052,842,6831416,103,Original tweet,https://t.co/2H5SKmk0k7,Meet Zuzu. He just graduated college. Astute pupper. Needs 2 leashes to contain him. Wasn't ready for the pic. 10/10 https://t.co/2H5SKmk0k7,10.0,10.0,Zuzu,False,False,True,False,2015,12,11
675111688094527488,1011,272,6831416,103,Original tweet,https://t.co/lFU9W31Fg9,Say hello to Oliver. He thought what was inside the pillow should be outside the pillow. Blurry since birth. 8/10 https://t.co/lFU9W31Fg9,8.0,10.0,Oliver,False,False,False,False,2015,12,11
675109292475830276,2928,1216,6831416,103,Original tweet,https://t.co/WjcELNEqN2,C'mon guys. We've been over this. We only rate dogs. This is a cow. Please only submit dogs. Thank you...... 9/10 https://t.co/WjcELNEqN2,9.0,10.0,a,False,False,False,False,2015,12,11
675047298674663426,1110,354,6831416,103,Original tweet,https://t.co/diboDRUuEI,This is a fluffy albino Bacardi Columbia mix. Excellent at the tweets. 11/10 would hug gently https://t.co/diboDRUuEI,11.0,10.0,a,False,False,False,False,2015,12,10
675015141583413248,2846,1290,6831416,103,Original tweet,https://t.co/JAncIdNp8G,Meet Moe. He's a golden Fetty Woof. Doesn't respect the authorities. Might own a motorhome? 10/10 revolutionary pup https://t.co/JAncIdNp8G,10.0,10.0,Moe,False,False,False,False,2015,12,10
675006312288268288,1023,242,6831416,103,Original tweet,https://t.co/QMmAqA9VqO,Say hello to Mollie. This pic was taken after she bet all her toys on Ronda Rousey. 10/10 hang in there pupper https://t.co/QMmAqA9VqO,10.0,10.0,Mollie,False,False,True,False,2015,12,10
675003128568291329,1624,505,6831416,103,Original tweet,https://t.co/pCGDgLkLo6,Meet Laela. She's adorable. Magnificent eyes. But I don't see a seat belt. Insubordinate.. and churlish. Still 12/10 https://t.co/pCGDgLkLo6,12.0,10.0,Laela,False,False,False,False,2015,12,10
674999807681908736,2362,1190,6831416,103,Original tweet,https://t.co/i9CDd1oEu8,Ok last one of these. I may try to make some myself. Anyway here ya go. 13/10 https://t.co/i9CDd1oEu8,13.0,10.0,None,False,False,False,False,2015,12,10
674805413498527744,906,380,6831416,103,Original tweet,https://t.co/vqFkgYPCW8,"When your entire life is crumbling before you and you're trying really hard to hold your shit together.
10/10 https://t.co/vqFkgYPCW8",10.0,10.0,None,False,False,False,False,2015,12,10
674800520222154752,3153,929,6831416,103,Original tweet,https://t.co/cMI2AcLm4B,This is Tedders. He broke his leg saving babies from the Pompeii eruption. 11/10 where's his Purple Heart? @POTUS https://t.co/cMI2AcLm4B,11.0,10.0,Tedders,False,False,False,False,2015,12,10
674793399141146624,2631,1174,6831416,103,Original tweet,https://t.co/HwroPYv8pY,I have found another. 13/10 https://t.co/HwroPYv8pY,13.0,10.0,None,False,False,False,False,2015,12,10
674790488185167872,1152,271,6831416,103,Original tweet,https://t.co/L1puJISV1a,ER... MER... GERD 13/10 https://t.co/L1puJISV1a,13.0,10.0,None,False,False,False,False,2015,12,10
674788554665512960,846,223,6831416,103,Original tweet,https://t.co/P3ElQ2wsjb,Say hello to Maggie. She's a Western Septic Downy. Pretends to be Mexican. Great hardwood flooring. 9/10 https://t.co/P3ElQ2wsjb,9.0,10.0,Maggie,False,False,False,False,2015,12,10
674781762103414784,2098,1299,6831416,103,Original tweet,https://t.co/ot8yMUGodj,Bedazzled pup here. Fashionable af. Super yellow. Looks hella fluffy. Webbed paws for efficient fetching. 8/10 https://t.co/ot8yMUGodj,8.0,10.0,None,False,False,False,False,2015,12,10
674774481756377088,1181,513,6831416,103,Original tweet,https://t.co/gxIFgg8ktm,This is Superpup. His head isn't proportional to his body. Has yet to serve any justice. 11/10 maybe one day pupper https://t.co/gxIFgg8ktm,11.0,10.0,Superpup,False,False,True,False,2015,12,10
674767892831932416,1922,858,6831416,103,Original tweet,https://t.co/Bob33W4sfD,This pup was carefully tossed to make it look like she's riding that horse. I have no words this is fabulous. 12/10 https://t.co/Bob33W4sfD,12.0,10.0,None,False,False,False,False,2015,12,10
674764817387900928,826,258,6831416,103,Original tweet,https://t.co/RBiQ8hPqwr,These two pups are masters of camouflage. Very dedicated to the craft. Both must've spent decades practicing. 10/10s https://t.co/RBiQ8hPqwr,10.0,10.0,None,False,False,False,False,2015,12,10
674754018082705410,1425,481,6831416,103,Original tweet,https://t.co/9YmNcxA2Cc,Just received another perfect photo of dogs and the sunset. 12/10 https://t.co/9YmNcxA2Cc,12.0,10.0,None,False,False,False,False,2015,12,10
674752233200820224,1540,501,6831416,103,Original tweet,https://t.co/rLf7asnHxO,Everyone please just appreciate how perfect these two photos are. 12/10 for both https://t.co/rLf7asnHxO,12.0,10.0,None,False,False,False,False,2015,12,10
674743008475090944,1470,587,6831207,103,Original tweet,https://t.co/VagYftZccT,This is Sophie. She just saw a spider. 10/10 don't just stand there Sophie https://t.co/VagYftZccT,10.0,10.0,Sophie,False,False,False,False,2015,12,10
674742531037511680,514,54,6831416,103,Original tweet,u,Some clarification is required. The dog is singing Cher and that is more than worthy of an 11/10. Thank you,11.0,10.0,None,False,False,False,False,2015,12,10
674739953134403584,1172,422,6831416,103,Original tweet,https://t.co/URNs5zFskc,"""ðŸŽ¶ DO YOU BELIEVE IN LIFE AFTER LOVE ðŸŽ¶""
11/10 https://t.co/URNs5zFskc",11.0,10.0,None,False,False,False,False,2015,12,9
674737130913071104,673,99,6831417,103,Original tweet,https://t.co/KNfLnYPmYh,Meet Rufio. He is unaware of the pink legless pupper wrapped around him. Might want to get that checked 10/10 &amp; 4/10 https://t.co/KNfLnYPmYh,10.0,10.0,Rufio,False,False,True,False,2015,12,9
674690135443775488,1201,499,6831417,103,Original tweet,https://t.co/Unz1uNrOzo,Meet Patrick. He's an exotic pup. Jumps great distances for a dog. Always gets injured when I toss him a ball. 3/10 https://t.co/Unz1uNrOzo,3.0,10.0,Patrick,False,False,False,False,2015,12,9
674670581682434048,1692,699,6831417,103,Original tweet,https://t.co/NRNExUy9Hm,Meet Jeb &amp; Bush. Jeb is somehow stuck in that fence and Bush won't stop whispering sweet nothings in his ear. 9/10s https://t.co/NRNExUy9Hm,9.0,10.0,Jeb,False,False,False,False,2015,12,9
674664755118911488,963,271,6831417,103,Original tweet,https://t.co/S8wCLemrNb,This is Rodman. He's getting destroyed by the surfs. Valiant effort though. 10/10 better than most puppers probably https://t.co/S8wCLemrNb,10.0,10.0,Rodman,False,False,False,False,2015,12,9
674646392044941312,1499,538,6831417,103,Original tweet,https://t.co/YPfw7oahbD,Two gorgeous dogs here. Little waddling dog is a rebel. Refuses to look at camera. Must be a preteen. 5/10 &amp; 8/10 https://t.co/YPfw7oahbD,5.0,10.0,None,False,False,False,False,2015,12,9
674644256330530816,1075,295,6831417,103,Original tweet,https://t.co/m6aC8d1Kzp,When you see sophomores in high school driving. 11/10 https://t.co/m6aC8d1Kzp,11.0,10.0,None,False,False,False,False,2015,12,9
674638615994089473,1754,628,6831417,103,Original tweet,https://t.co/F33n1hy3LL,This pupper is fed up with being tickled. 12/10 I'm currently working on an elaborate heist to steal this dog https://t.co/F33n1hy3LL,12.0,10.0,None,False,False,True,False,2015,12,9
674632714662858753,1566,615,6831417,103,Original tweet,https://t.co/EJzzNHE8bE,Rare submerged pup here. Holds breath for a long time. Frowning because that spoon ignores him. 5/10 would still pet https://t.co/EJzzNHE8bE,5.0,10.0,None,False,False,False,False,2015,12,9
674606911342424069,985,108,6831417,103,Original tweet,s,The 13/10 also takes into account this impeccable yard. Louis is great but the future dad in me can't ignore that luscious green grass,13.0,10.0,None,False,False,False,False,2015,12,9
674468880899788800,6504,2209,6831417,103,Original tweet,https://t.co/6d9WziPXmx,This is Louis. He thinks he's flying. 13/10 this is a legendary pup https://t.co/6d9WziPXmx,13.0,10.0,Louis,False,False,False,False,2015,12,9
674447403907457024,1110,382,6831417,103,Original tweet,https://t.co/AyJ7Ohk71f,This pupper just wants a belly rub. This pupper has nothing to do w the tree being sideways now. 10/10 good pupper https://t.co/AyJ7Ohk71f,10.0,10.0,None,False,False,True,False,2015,12,9
674436901579923456,1166,420,6831417,103,Original tweet,https://t.co/CLEOjxhTEx,Meet Bailey. She plays with her food. Very childish. Doesn't even need a battle helmet smh. Still cute though. 9/10 https://t.co/CLEOjxhTEx,9.0,10.0,Bailey,False,False,False,False,2015,12,9
674422304705744896,1492,568,6831417,103,Original tweet,https://t.co/BxTJAFSIgk,This is Ava. She doesn't understand flowers. 12/10 would caress firmly https://t.co/BxTJAFSIgk,12.0,10.0,Ava,False,False,False,False,2015,12,9
674416750885273600,711,149,6831417,103,Original tweet,https://t.co/7qjXy1uUYY,This is Jonah. He's a Stinted Fisher Price. Enjoys chewing on his miniature RipStik. 10/10 very upbeat fellow https://t.co/7qjXy1uUYY,10.0,10.0,Jonah,False,False,False,False,2015,12,9
674410619106390016,1250,500,6831417,103,Original tweet,https://t.co/CZ0YaB40Hn,This is Lenny. He wants to be a sprinkler. 10/10 you got this Lenny https://t.co/CZ0YaB40Hn,10.0,10.0,Lenny,False,False,False,False,2015,12,9
674394782723014656,1563,615,6831417,103,Original tweet,https://t.co/cAlB4XCcsi,This is Gary. He's a hide and seek champion. Second only to Kony. 8/10 Gary has a gift https://t.co/cAlB4XCcsi,8.0,10.0,Gary,False,False,False,False,2015,12,9
674372068062928900,888,330,6831417,103,Original tweet,https://t.co/G4m0TFY9uc,Meet Chesney. On the outside he stays calm &amp; collected. On the inside he's having a complete mental breakdown. 10/10 https://t.co/G4m0TFY9uc,10.0,10.0,Chesney,False,False,False,False,2015,12,8
674330906434379776,583,77,6831417,103,Original tweet,7,"13/10
@ABC7",13.0,10.0,None,False,False,False,False,2015,12,8
