tweet_id,favorite_count,retweet_count,followers_count,friends_count,retweeted_status,url,text,rating_numerator,rating_denominator,name,doggo,floofer,pupper,puppo,year,month,day
798925684722855936,8115,1621,6831336,103,Original tweet,https://t.co/XzX91DfYVV,This is Shadow. He's a firm believer that they're all good dogs. H*ckin passionate about it too. 11/10 I stand with Shadow https://t.co/8yvpacwBcu,11.0,10.0,Shadow,False,False,False,False,2016,11,16
798209839306514432,11348,2880,6831337,103,Original tweet,https://t.co/jG1PAFkB81,This is Cooper. His bow tie was too heavy for the front so he moved it to the side. Balanced af now. 13/10 https://t.co/jG1PAFkB81,13.0,10.0,Cooper,False,False,False,False,2016,11,14
797971864723324932,12757,3556,6831337,103,Original tweet,https://t.co/GRWPgNKt2z,Here's a helicopter pupper. He takes off at random. H*ckin hard to control. 12/10 rare af https://t.co/GRWPgNKt2z,12.0,10.0,None,False,False,True,False,2016,11,14
797545162159308800,15888,5478,6831337,103,Original tweet,https://t.co/Ia19irLwyB,This is Cassie. She steals things. Guilt increases slightly each time. 12/10 would forgive almost immediately https://t.co/Ia19irLwyB,12.0,10.0,Cassie,False,False,False,False,2016,11,12
797236660651966464,21899,7489,6831338,103,Original tweet,https://t.co/6kqsAjJNhi,This is Pancake. She loves Batman and winks like a h*ckin champ. 12/10 real crowd pleaser https://t.co/6kqsAjJNhi,12.0,10.0,Pancake,False,False,False,False,2016,11,12
797165961484890113,251,32,6831338,103,Original tweet,ðŸ˜‰,@JODYHiGHROLLER it may be an 11/10 but what do I know ðŸ˜‰,11.0,10.0,None,False,False,False,False,2016,11,11
796865951799083009,8397,2144,6831338,103,Original tweet,https://t.co/Jgnuiyvq06,This is Tyr. He's just checking on you. Nifty af tongue slip. 12/10 would absolutely pet https://t.co/Jgnuiyvq06,12.0,10.0,Tyr,False,False,False,False,2016,11,11
796759840936919040,12994,3458,6831338,103,Original tweet,https://t.co/6hx7ur6sNI,Say hello to Romeo. He was just told that it's too cold for the pool. H*ckin nonsense. 11/10 would help fill up https://t.co/6hx7ur6sNI,11.0,10.0,Romeo,False,False,False,False,2016,11,10
796484825502875648,8297,1991,6831338,103,Original tweet,https://t.co/bvkkqOjNDV,Here's a sleepy doggo that requested some assistance. 12/10 would carry everywhere https://t.co/bvkkqOjNDV,12.0,10.0,None,True,False,False,False,2016,11,9
796387464403357696,12072,4707,6831338,103,Original tweet,https://t.co/CE3SrCv6L3,This is Snicku. He's having trouble reading because he's a dog. Glasses only helped a little. Nap preferred. 12/10 would snug well https://t.co/cVLUasbKA5,12.0,10.0,Snicku,False,False,False,False,2016,11,9
796149749086875649,35456,16187,6831338,103,Original tweet,https://t.co/y5KarNXWXt,This is Ruby. She just turned on the news. Officially terrified. 11/10 deep breaths Ruby https://t.co/y5KarNXWXt,11.0,10.0,Ruby,False,False,False,False,2016,11,9
796125600683540480,5415,2018,6831338,103,Original tweet,https://t.co/a18mzkhTf6,"#ImWithThor 13/10
https://t.co/a18mzkhTf6",13.0,10.0,None,False,False,False,False,2016,11,8
796116448414461957,9940,2735,6831338,103,Original tweet,https://t.co/7i0bDMbrVN,I didn't believe it at first but now I can see that voter fraud is a serious h*ckin issue. 11/10 https://t.co/7i0bDMbrVN,11.0,10.0,None,False,False,False,False,2016,11,8
796080075804475393,9250,2616,6831338,103,Original tweet,https://t.co/opoXKxmfFm,This is Yogi. He's 98% floof. Snuggable af. 12/10 https://t.co/opoXKxmfFm,12.0,10.0,Yogi,False,False,False,False,2016,11,8
796031486298386433,11827,4174,6831338,103,Original tweet,https://t.co/PbgvuD0qIL,This is Daisy. She's here to make your day better. 13/10 mission h*ckin successful https://t.co/PbgvuD0qIL,13.0,10.0,Daisy,False,False,False,False,2016,11,8
795464331001561088,54590,26929,6831338,103,Original tweet,https://t.co/gBUDjdEcqz,Elder doggo does a splash. Both 13/10 incredible stuff https://t.co/gBUDjdEcqz,13.0,10.0,None,True,False,False,False,2016,11,7
795400264262053889,11062,3236,6831338,103,Original tweet,https://t.co/2H4MfOGlpQ,This is Brody. He's trying to make the same face as the football. 12/10 https://t.co/2H4MfOGlpQ,12.0,10.0,Brody,False,False,False,False,2016,11,6
795076730285391872,17774,6129,6831338,103,Original tweet,https://t.co/ivPWhspN3E,This is Bailey. She loves going down slides but is very bad at it. Still 11/10 https://t.co/ivPWhspN3E,11.0,10.0,Bailey,False,False,False,False,2016,11,6
794926597468000259,11258,2616,6831338,103,Original tweet,https://t.co/XRPvTPF0VH,This is Mack. He's rather h*ckin sleepy. Exceptional ears. 12/10 would boop https://t.co/XRPvTPF0VH,12.0,10.0,Mack,False,False,False,False,2016,11,5
794332329137291264,10461,2988,6831338,103,Original tweet,https://t.co/yF6kcAT3gx,This is Nimbus (like the cloud). He just bought this fancy af duck raincoat. Only protects one ear tho. 12/10 so h*ckin floofy https://t.co/SIQbb8c3AU,12.0,10.0,Nimbus,False,False,False,False,2016,11,4
794205286408003585,10087,3760,6831338,103,Original tweet,https://t.co/6vnu1aYjbU,This is Laika. She was a space pupper. The first space pupper actually. Orbited earth like a h*ckin boss. 14/10 hero af https://t.co/trSjgY3h4g,14.0,10.0,Laika,False,False,True,False,2016,11,3
793962221541933056,18458,5538,6831338,103,Original tweet,https://t.co/xIfrsMNLBR,This is Maximus. His face is stuck like that. Tragic really. Great tongue tho. 12/10 would pet firmly https://t.co/xIfrsMNLBR,12.0,10.0,Maximus,False,False,False,False,2016,11,2
793845145112371200,10073,2119,6831338,103,Original tweet,https://t.co/2Xo19aPrG5,This is Clark. He was just caught wearing pants. 13/10 game-changing af https://t.co/2Xo19aPrG5,13.0,10.0,Clark,False,False,False,False,2016,11,2
793601777308463104,8729,1849,6831338,103,Original tweet,https://t.co/LhzPWv6rTv,This is Dobby. I can't stop looking at her feet. 12/10 would absolutely snug https://t.co/LhzPWv6rTv,12.0,10.0,Dobby,False,False,False,False,2016,11,1
793500921481273345,11713,2694,6831338,103,Original tweet,https://t.co/aF5MmpvPqN,This is Fiona. She's an extremely mediocre copilot. Very distracting. Wink makes up for all the missed turns. 12/10 https://t.co/aF5MmpvPqN,12.0,10.0,Fiona,False,False,False,False,2016,11,1
793286476301799424,26980,10396,6831338,103,Original tweet,https://t.co/rLHGx3VAF3,This is Moreton. He's the Good Boy Who Lived. 13/10 magical as h*ck https://t.co/rLHGx3VAF3,13.0,10.0,Moreton,False,False,False,False,2016,11,1
793271401113350145,9455,2666,6831338,103,Original tweet,https://t.co/NA1VR1PkjD,Meet Dave. It's his favorite day of the year. He gets to fulfill his dream of being a dinosaur. 12/10 inspirational af https://t.co/MgQSdfZGPN,12.0,10.0,Dave,False,False,False,False,2016,11,1
793256262322548741,21880,9412,6831338,103,Original tweet,https://t.co/BNy9IIJMb0,Oh h*ck look at this spookling right here. Fright level off the charts. 12/10 sufficiently spooked https://t.co/BNy9IIJMb0,12.0,10.0,None,False,False,False,False,2016,11,1
793241302385262592,11545,3710,6831338,103,Original tweet,https://t.co/Ap477GhwXt,This is Tucker. He's out here bustin h*ckin ghosts. 13/10 dedicated af https://t.co/Ap477GhwXt,13.0,10.0,Tucker,False,False,False,False,2016,11,1
793226087023144960,10768,3228,6831338,103,Original tweet,https://t.co/K4dvelOMsM,"This is Juno. She spooked me up real good, but only to get my attention. Above average handwriting for a dog I think. 11/10 https://t.co/hFxxBCWlwj",11.0,10.0,Juno,False,False,False,False,2016,10,31
793210959003287553,9783,3190,6831338,103,Original tweet,https://t.co/etL8FHBrh8,This is Maude. She's the h*ckin happiest wasp you've ever seen. 10/10 would pet with caution https://t.co/etL8FHBrh8,10.0,10.0,Maude,False,False,False,False,2016,10,31
793195938047070209,16730,6345,6831338,103,Original tweet,https://t.co/YSi6K1firY,Say hello to Lily. She's pupset that her costume doesn't fit as well as last year. 12/10 poor puppo https://t.co/YSi6K1firY,12.0,10.0,Lily,False,False,False,True,2016,10,31
793180763617361921,7574,2241,6831338,103,Original tweet,https://t.co/2VhmlwxA1Q,This is Newt. He's a strawberry. 11/10 https://t.co/2VhmlwxA1Q,11.0,10.0,Newt,False,False,False,False,2016,10,31
793165685325201412,10294,3146,6831338,103,Original tweet,https://t.co/cXDCGTiL1x,This is Benji. He's Air Bud. It's a low effort costume but he pulls it off rather h*ckin well. 12/10 would happily get dunked on https://t.co/IbzT7DJvBo,12.0,10.0,Benji,False,False,False,False,2016,10,31
793150605191548928,6759,1930,6831338,103,Original tweet,https://t.co/3lE8Izgmkf,This is Nida. She's a free elf. Waited so long for this day. 11/10 https://t.co/3lE8Izgmkf,11.0,10.0,Nida,False,False,False,False,2016,10,31
793135492858580992,7069,2803,6831338,103,Original tweet,https://t.co/PrgvOyPtDT,Your favorite squad is looking extra h*ckin spooky today. 13/10 for all https://t.co/PrgvOyPtDT,13.0,10.0,None,False,False,False,False,2016,10,31
793120401413079041,13897,4405,6831338,103,Original tweet,https://t.co/asFvEjQQsl,"This is Robin. She's desperately trying to do me a frighten, but her tongue drastically decreases her spook value. Still 11/10 great effort https://t.co/sxMrsOZ8zb",11.0,10.0,Robin,False,False,False,False,2016,10,31
792913359805018113,15730,4545,6831338,103,Original tweet,https://t.co/LRyMrU7Wfq,Here is a perfect example of someone who has their priorities in order. 13/10 for both owner and Forrest https://t.co/LRyMrU7Wfq,13.0,10.0,a,False,False,False,False,2016,10,31
792883833364439040,12390,4828,6831338,103,Original tweet,https://t.co/v17mFm0Ftz,This is Bailey. She's rather h*ckin hype for Halloween tomorrow. Carved those pupkins herself. 12/10 https://t.co/v17mFm0Ftz,12.0,10.0,Bailey,False,False,False,False,2016,10,31
792773781206999040,8040,1900,6831338,103,Original tweet,https://t.co/RhaPExuxJL,This is Monster. Not an actual monster tho. He's showing you his tongue. Very impressive Monster. 12/10 would snug https://t.co/RhaPExuxJL,12.0,10.0,Monster,False,False,False,False,2016,10,30
792394556390137856,14787,4847,6831338,103,Original tweet,https://t.co/of0pFNBIl8,Meet BeBe. She rocks the messy bun of your dreams. H*ckin flawless. 12/10 would watch her tutorial https://t.co/of0pFNBIl8,12.0,10.0,BeBe,False,False,False,False,2016,10,29
792050063153438720,7861,2030,6831338,103,Original tweet,https://t.co/kte5KPffQj,This is Remus. He's a mop that came to life. Can't see anything. Constantly trips over himself. Still a very good dog. 11/10 https://t.co/S3f1SYylzu,11.0,10.0,Remus,False,False,False,False,2016,10,28
791774931465953280,49376,25128,6831338,103,Original tweet,https://t.co/roqIxCvEB3,Vine will be deeply missed. This was by far my favorite one. 14/10 https://t.co/roqIxCvEB3,14.0,10.0,None,False,False,False,False,2016,10,27
791672322847637504,12862,3533,6831338,103,Original tweet,https://t.co/O5IUmRHRIh,When she says you're a good boy and you know you're a good boy because you're a good boy. 13/10 https://t.co/O5IUmRHRIh,13.0,10.0,None,False,False,False,False,2016,10,27
791406955684368384,14382,4646,6831338,103,Original tweet,https://t.co/zoWrqNMHrl,Say hello to Levi. He's a Madagascan Butterbop. One of the more docile Butterbops I've seen. 12/10 would give all the pets https://t.co/Zcw9Sccctc,12.0,10.0,Levi,False,False,False,False,2016,10,26
791312159183634433,9624,2865,6831338,103,Original tweet,https://t.co/GGJvxYt3xK,This is Mabel. She's super h*ckin smol. Portable af. Comes with the smol shoe. 12/10 would keep in frocket https://t.co/GGJvxYt3xK,12.0,10.0,Mabel,False,False,False,False,2016,10,26
790987426131050500,10845,2413,6831338,103,Original tweet,https://t.co/Eno0mypHIr,This is Misty. She has a cowboy hat on her nose. 12/10 https://t.co/Eno0mypHIr,12.0,10.0,Misty,False,False,False,False,2016,10,25
790946055508652032,18195,5313,6831338,103,Original tweet,https://t.co/dgvTPZ9tgI,This is Betty. She's assisting with the dishes. Such a good puppo. 12/10 h*ckin helpful af https://t.co/dgvTPZ9tgI,12.0,10.0,Betty,False,False,False,True,2016,10,25
790698755171364864,8989,2151,6831338,103,Original tweet,https://t.co/IiiBq460I7,This is Mosby. He appears to be rather h*ckin snuggable af. 12/10 keep it up Mosby https://t.co/IiiBq460I7,12.0,10.0,Mosby,False,False,False,False,2016,10,24
790581949425475584,22647,8091,6831338,103,Original tweet,https://t.co/Fd5WFDTMH4,This is Duke. He sneaks into the fridge sometimes. It's his safe place. 11/10 would give little jacket if necessary https://t.co/Fd5WFDTMH4,11.0,10.0,Duke,False,False,False,False,2016,10,24
790337589677002753,8567,2106,6831338,103,Original tweet,https://t.co/ovE2hqXryV,Meet Maggie. She can hear your cells divide. 12/10 can also probably fly https://t.co/ovE2hqXryV,12.0,10.0,Maggie,False,False,False,False,2016,10,23
790277117346975746,13756,3634,6831338,103,Original tweet,https://t.co/aI7umZHIq7,This is Bruce. He never backs down from a challenge. 11/10 you got this Bruce https://t.co/aI7umZHIq7,11.0,10.0,Bruce,False,False,False,False,2016,10,23
789986466051088384,10138,2620,6831338,103,Original tweet,https://t.co/Ln89R4FP7v,This is Happy. He's a bathtub reviewer. Seems to be pleased with this one. 12/10 https://t.co/Ln89R4FP7v,12.0,10.0,Happy,False,False,False,False,2016,10,23
789903600034189313,11392,4674,6831338,103,Original tweet,https://t.co/P0kSN6rT6H,This is Ralphy. His dreams were just shattered. Poor pupper. 13/10 it'll be ok Ralphy https://t.co/P0kSN6rT6H,13.0,10.0,Ralphy,False,False,True,False,2016,10,22
789628658055020548,8256,2010,6831338,103,Original tweet,https://t.co/huPSJJ7FDI,This is Eli. He can fly. 13/10 magical af https://t.co/huPSJJ7FDI,13.0,10.0,Eli,False,False,False,False,2016,10,22
789599242079838210,7431,2185,6831338,103,Original tweet,https://t.co/0R4meWXFOx,This is Brownie. She's wearing a Halloween themed onesie. 12/10 festive af https://t.co/0R4meWXFOx,12.0,10.0,Brownie,False,False,False,False,2016,10,21
789530877013393408,12875,3813,6831338,103,Original tweet,https://t.co/TU4sZogVIq,This is Rizzy. She smiles a lot. 12/10 contagious af https://t.co/TU4sZogVIq,12.0,10.0,Rizzy,False,False,False,False,2016,10,21
789314372632018944,9433,2607,6831338,103,Original tweet,https://t.co/G2ms0A5jWM,"HE WAS JUST A LIL SLEEPY FROM BEING SUCH A GOOD DOGGI ALL THE TIME MISTAKES HAPPEN 13/10
https://t.co/G2ms0A5jWM",13.0,10.0,None,False,False,False,False,2016,10,21
789268448748703744,9991,2925,6831338,103,Original tweet,https://t.co/JSs2bfDtTS,This is Stella. She's happier than I will ever be. 10/10 would trade lives with https://t.co/JSs2bfDtTS,10.0,10.0,Stella,False,False,False,False,2016,10,21
789137962068021249,10637,3150,6831338,103,Original tweet,https://t.co/2jwxxtNzoN,This is Bo. He's a West Congolese Bugaboop Snuggle. Rather exotic. Master of the head tilt. 12/10 would pay to pet https://t.co/2jwxxtNzoN,12.0,10.0,Bo,False,False,False,False,2016,10,20
788908386943430656,29985,14001,6831338,103,Original tweet,https://t.co/3BXh073tDm,"This is Lucy. She destroyed not one, but two remotes trying to turn off the debate. 11/10 relatable af https://t.co/3BXh073tDm",11.0,10.0,Lucy,False,False,False,False,2016,10,20
788765914992902144,30032,11637,6831338,103,Original tweet,https://t.co/x5gXRS1abq,This is Butter. She can have whatever she wants forever. 12/10 would hug softly https://t.co/x5gXRS1abq,12.0,10.0,Butter,False,False,False,False,2016,10,19
788412144018661376,17093,5990,6831338,103,Original tweet,https://t.co/4DhSsC1W7S,This is Dexter. He breaks hearts for a living. 11/10 h*ckin handsome af https://t.co/4DhSsC1W7S,11.0,10.0,Dexter,False,False,False,False,2016,10,18
788178268662984705,7920,2404,6831338,103,Original tweet,https://t.co/s7MgFWDySc,Atlas is back and this time he's got doggles. Still 13/10 solarly conscious af https://t.co/s7MgFWDySc,13.0,10.0,None,False,False,False,False,2016,10,18
788150585577050112,6737,1472,6831338,103,Original tweet,https://t.co/xosHjFzVXc,This is Leo. He's a golden chow. Rather h*ckin rare. 13/10 would give extra pats https://t.co/xosHjFzVXc,13.0,10.0,Leo,False,False,False,False,2016,10,17
788039637453406209,6720,1493,6831338,103,Original tweet,https://t.co/lRmUUOxgbQ,Did... did they pick out that license plate? 12/10 for both https://t.co/lRmUUOxgbQ,12.0,10.0,None,False,False,False,False,2016,10,17
787810552592695296,9501,3442,6831338,103,Original tweet,https://t.co/pNNjBtHWPc,This is Frank. He wears sunglasses and walks himself. 11/10 I'll never be this cool or independent https://t.co/pNNjBtHWPc,11.0,10.0,Frank,False,False,False,False,2016,10,17
787717603741622272,11174,3135,6831338,103,Original tweet,https://t.co/i622ZbWkUp,This is Tonks. She is a service puppo. Can hear a caterpillar hiccup from 7 miles away. 13/10 would follow anywhere https://t.co/i622ZbWkUp,13.0,10.0,Tonks,False,False,False,True,2016,10,16
787397959788929025,11862,3194,6831338,103,Original tweet,https://t.co/lHVHGdDzb3,This is Moose. He's rather h*ckin dangerous (you can tell by the collar). 11/10 would still attempt to snug https://t.co/lHVHGdDzb3,11.0,10.0,Moose,False,False,False,False,2016,10,15
787322443945877504,8539,1972,6831338,103,Original tweet,https://t.co/lsrR83SiVp,This is Lincoln. He forgot to use his blinker when he changed lanes just now. Guilty as h*ck. Still 10/10 https://t.co/lsrR83SiVp,10.0,10.0,Lincoln,False,False,False,False,2016,10,15
786963064373534720,29077,9041,6831338,103,Original tweet,https://t.co/ibj5g6xaAj,This is Rory. He's got an interview in a few minutes. Looking spiffy af. Nervous as h*ck tho. 12/10 would hire https://t.co/ibj5g6xaAj,12.0,10.0,Rory,False,False,False,False,2016,10,14
786709082849828864,19893,6871,6831338,103,Original tweet,https://t.co/yBO5wuqaPS,"This is Logan, the Chow who lived. He solemnly swears he's up to lots of good. H*ckin magical af 9.75/10 https://t.co/yBO5wuqaPS",9.75,10.0,Logan,False,False,False,False,2016,10,13
786664955043049472,11687,2898,6831338,103,Original tweet,https://t.co/HmlEvAMP4r,"""Honestly Kathleen I just want more Ken Bone"" 12/10 https://t.co/HmlEvAMP4r",12.0,10.0,None,False,False,False,False,2016,10,13
786595970293370880,10283,3501,6831338,103,Original tweet,https://t.co/L8BWDD4oBX,This is Dale. He's a real spookster. Did me quite the frighten. 11/10 not too spooky to pet tho https://t.co/L8BWDD4oBX,11.0,10.0,Dale,False,False,False,False,2016,10,13
786363235746385920,11932,3957,6831338,103,Original tweet,https://t.co/TVXpEJB7Wn,This is Rizzo. He has many talents. A true renaissance doggo. 13/10 entertaining af https://t.co/TVXpEJB7Wn,13.0,10.0,Rizzo,True,False,False,False,2016,10,13
786286427768250368,8741,3239,6831338,103,Original tweet,https://t.co/ObT2tSxXit,This is Arnie. He's afraid of his own bark. 12/10 would comfort https://t.co/ObT2tSxXit,12.0,10.0,Arnie,False,False,False,False,2016,10,12
786233965241827333,16783,5402,6831338,103,Original tweet,https://t.co/2NsFXeX1Io,This is Mattie. She's extremely dangerous. Will bite your h*ckin finger right off. Still 11/10 would pet with caution https://t.co/78c9W8kLFh,11.0,10.0,Mattie,False,False,False,False,2016,10,12
786051337297522688,1575,174,6831338,103,Original tweet,t,13/10 for breakdancing puppo @shibbnbot,13.0,10.0,None,False,False,False,True,2016,10,12
785927819176054784,12442,3557,6831338,103,Original tweet,https://t.co/lntsj7Fc4Y,This is Lucy. She's strives to be the best potato she can be. 12/10 would boop https://t.co/lntsj7Fc4Y,12.0,10.0,Lucy,False,False,False,False,2016,10,11
785872687017132033,7311,2062,6831338,103,Original tweet,https://t.co/1j9kLGb4wV,Meet Rusty. He appears to be rather h*ckin fluffy. Also downright adorable af. 12/10 would rub my face against his https://t.co/1j9kLGb4wV,12.0,10.0,Rusty,False,False,False,False,2016,10,11
785639753186217984,8537,2493,6831338,103,Original tweet,https://t.co/aBsZTpv6mM,This is Pinot. He's a sophisticated doggo. You can tell by the hat. Also pointier than your average pupper. Still 10/10 would pet cautiously https://t.co/f2wmLZTPHd,10.0,10.0,Pinot,True,False,True,False,2016,10,11
785533386513321988,9977,2267,6831338,103,Original tweet,https://t.co/h4jhlH4EyG,This is Dallas. Her tongue is ridiculous. 11/10 h*ckin proud af https://t.co/h4jhlH4EyG,11.0,10.0,Dallas,False,False,False,False,2016,10,10
785515384317313025,6666,1428,6831338,103,Original tweet,y,"Today, 10/10, should be National Dog Rates Day",10.0,10.0,None,False,False,False,False,2016,10,10
785264754247995392,7948,1849,6831338,103,Original tweet,https://t.co/mWYACm4qnx,This is Doc. He requested to be carried around like that. 12/10 anything for Doc https://t.co/mWYACm4qnx,12.0,10.0,Doc,False,False,False,False,2016,10,9
785170936622350336,13237,5489,6831338,103,Original tweet,https://t.co/rKCJnWRpR2,This is Hero. He was enjoying the car ride until he remembered that bees are dying globally at an alarming rate. 11/10 https://t.co/cubFg7F4qQ,11.0,10.0,Hero,False,False,False,False,2016,10,9
784826020293709826,11101,3628,6831338,103,Original tweet,https://t.co/AsykOwMrXQ,This is Rusty. He's going D1 for sure. Insane vertical. 13/10 would draft https://t.co/AsykOwMrXQ,13.0,10.0,Rusty,False,False,False,False,2016,10,8
784517518371221505,9813,2862,6831338,103,Original tweet,https://t.co/p6fgYe2dB6,This is Frankie. He has yet to learn how to control his tongue. 11/10 maybe one day https://t.co/p6fgYe2dB6,11.0,10.0,Frankie,False,False,False,False,2016,10,7
784431430411685888,6210,1445,6831338,103,Original tweet,https://t.co/PHA1vtqqpt,This is Stormy. He's curly af. Already pupared for Coachella next year. 12/10 https://t.co/PHA1vtqqpt,12.0,10.0,Stormy,False,False,False,False,2016,10,7
784183165795655680,22008,9101,6831338,103,Original tweet,https://t.co/t0cEeRbcXJ,This is Reginald. He's one magical puppo. Aerodynamic af. 12/10 would catch https://t.co/t0cEeRbcXJ,12.0,10.0,Reginald,False,False,False,True,2016,10,7
784057939640352768,32721,12603,6831338,103,Original tweet,https://t.co/T7Jr4Gw4sC,This is Balto. He's very content. Legendary tongue slippage. 12/10 would pet forever https://t.co/T7Jr4Gw4sC,12.0,10.0,Balto,False,False,False,False,2016,10,6
783839966405230592,32889,12204,6831338,103,Original tweet,https://t.co/KOTzaG7hiq,This is Riley. His owner put a donut pillow around him and he loves it so much he won't let anyone take it off. 13/10 https://t.co/8TCQcsZCZ8,13.0,10.0,Riley,False,False,False,False,2016,10,6
783821107061198850,8047,2217,6831338,103,Original tweet,https://t.co/STcPjiNAHp,This is Mairi. She has mastered the art of camouflage. 12/10 h*ckin sneaky af https://t.co/STcPjiNAHp,12.0,10.0,Mairi,False,False,False,False,2016,10,6
783695101801398276,11402,3624,6831338,103,Original tweet,https://t.co/iwUv1KnD1P,This is Loomis. He's the leader of the Kenneth search party. The passion is almost overwhelming. 12/10 one day he will be free https://t.co/kCRKlFg4AY,12.0,10.0,Loomis,False,False,False,False,2016,10,5
783466772167098368,9261,2539,6831338,103,Original tweet,https://t.co/UAw6F2p7ta,This is Finn. He likes eavesdropping from filing cabinets. It's a real issue but no one has approached him about it. 11/10 would still pet https://t.co/s8W8Del9HQ,11.0,10.0,Finn,False,False,False,False,2016,10,5
783391753726550016,18474,6215,6831338,103,Original tweet,https://t.co/BO936YdJdi,Meet Godi. He's an avid beachgoer and part time rainbow summoner. Eyeliner flawless af. 13/10 would snug well https://t.co/BO936YdJdi,13.0,10.0,Godi,False,False,False,False,2016,10,4
783334639985389568,31960,13206,6831338,103,Original tweet,https://t.co/nfprKAXqwu,This is Dave. He's currently in a predicament. Doesn't seem to mind tho. 12/10 someone assist Dave https://t.co/nfprKAXqwu,12.0,10.0,Dave,False,False,False,False,2016,10,4
783085703974514689,8903,2494,6831338,103,Original tweet,https://t.co/IsqyvbjFgM,This is Earl. He can't catch. Did his best tho. 11/10 would repair confidence with extra pats https://t.co/IsqyvbjFgM,11.0,10.0,Earl,False,False,False,False,2016,10,3
782969140009107456,26383,8281,6831338,103,Original tweet,https://t.co/vOBV1ZqVcX,This is Cali. She arrived preassembled. Convenient af. 12/10 appears to be rather h*ckin pettable https://t.co/vOBV1ZqVcX,12.0,10.0,Cali,False,False,False,False,2016,10,3
782747134529531904,8147,1568,6831338,103,Original tweet,https://t.co/C6fUMnHt1H,This is Deacon. He's the happiest almost dry doggo I've ever seen. 11/10 would smile back https://t.co/C6fUMnHt1H,11.0,10.0,Deacon,True,False,False,False,2016,10,3
782722598790725632,18854,6057,6831338,103,Original tweet,https://t.co/zrMVdfFej6,"This is Penny. She fought a bee and the bee won. 10/10 you're fine Penny, everything's fine https://t.co/zrMVdfFej6",10.0,10.0,Penny,False,False,False,False,2016,10,2
782598640137187329,8513,2117,6831129,103,Original tweet,https://t.co/BIUchFwHqn,This is Timmy. He's quite large. According to a trusted source it's actually a dog wearing a dog suit. 11/10 https://t.co/BIUchFwHqn,11.0,10.0,Timmy,False,False,False,False,2016,10,2
782305867769217024,18210,6266,6831338,103,Original tweet,https://t.co/pgVKxRw0s1,This is Sampson. He just graduated. Ready to be a doggo now. Time for the real world. 12/10 have fun with taxes https://t.co/pgVKxRw0s1,12.0,10.0,Sampson,True,False,False,False,2016,10,1
781955203444699136,12117,3789,6831338,103,Original tweet,https://t.co/3eXbCXZXXT,This is Chipson. He weighed in at .3 ounces and is officially super h*ckin smol. Space-saving af. 11/10 would snug delicately https://t.co/FjEsk7A1JV,11.0,10.0,Chipson,False,False,False,False,2016,9,30
781661882474196992,11409,3047,6831338,103,Original tweet,https://t.co/ELqelxWMrC,Who keeps sending in pictures without dogs in them? This needs to stop. 5/10 for the mediocre road https://t.co/ELqelxWMrC,5.0,10.0,None,False,False,False,False,2016,9,30
