tweet_id,favorite_count,retweet_count,followers_count,friends_count,retweeted_status,url,text,rating_numerator,rating_denominator,name,doggo,floofer,pupper,puppo,year,month,day
718971898235854848,3719,1202,6831383,103,Original tweet,https://t.co/JRckDkZVRT,This is Sadie. She is prepared for battle. 10/10 https://t.co/JRckDkZVRT,10.0,10.0,Sadie,False,False,False,False,2016,4,10
718939241951195136,5600,1916,6831383,103,Original tweet,https://t.co/I9qoe1uEih,This is Otis. Everybody look at Otis. 12/10 would probably faint while petting https://t.co/I9qoe1uEih,12.0,10.0,Otis,False,False,False,False,2016,4,9
718631497683582976,20218,8839,6831383,103,Original tweet,https://t.co/D9jbbmPmos,We normally don't rate marshmallows but this one appears to be flawlessly toasted so I'll make an exception. 10/10 https://t.co/D9jbbmPmos,10.0,10.0,None,False,False,False,False,2016,4,9
718613305783398402,2611,527,6831383,103,Original tweet,https://t.co/lK9YDkRzPj,This is Carper. He's a Tortellini Angiosperm. In desperate need of a petting. 11/10 would hug softly https://t.co/lK9YDkRzPj,11.0,10.0,Carper,False,False,False,False,2016,4,9
718540630683709445,2655,1103,6831383,103,Original tweet,https://t.co/zSbyvm62xZ,Get you a pup that can do both. 10/10 https://t.co/zSbyvm62xZ,10.0,10.0,None,False,False,False,False,2016,4,8
718460005985447936,2884,582,6831383,103,Original tweet,https://t.co/JyNmyjy3fe,Meet Bowie. He's listening for underground squirrels. Smart af. Left eye is considerably magical. 9/10 would so pet https://t.co/JyNmyjy3fe,9.0,10.0,Bowie,False,False,False,False,2016,4,8
718454725339934721,5205,1643,6831383,103,Original tweet,https://t.co/4kD16wMA1Z,"This pic is old but I hadn't seen it until today and had to share. Creative af. 13/10 very good boy, would pet well https://t.co/4kD16wMA1Z",13.0,10.0,None,False,False,False,False,2016,4,8
718246886998687744,2055,547,6831383,103,Original tweet,https://t.co/FmxOpf2Sgl,This is Alexanderson. He's got a weird ass birth mark. Dreadful at fetch. Won't eat kibble. 3/10 wtf @Target https://t.co/FmxOpf2Sgl,3.0,10.0,Alexanderson,False,False,False,False,2016,4,8
718234618122661888,4128,1090,6831383,103,Original tweet,https://t.co/05S8oYztgb,This is Suki. She was born with a blurry tail (unfortunate). Next level tongue tho. 11/10 nifty hardwood https://t.co/05S8oYztgb,11.0,10.0,Suki,False,False,False,False,2016,4,8
717841801130979328,2611,649,6831383,103,Original tweet,https://t.co/ucOEfr2rjV,This is Barclay. His father was a banana. 11/10 appeeling af https://t.co/ucOEfr2rjV,11.0,10.0,Barclay,False,False,False,False,2016,4,6
717790033953034240,3092,1232,6831383,103,Original tweet,https://t.co/fv9e9AtzSG,"Here's a badass mystery pupper. You weren't aware that you owe him money, but you do. 10/10 shades sick af https://t.co/fv9e9AtzSG",10.0,10.0,None,False,False,True,False,2016,4,6
717537687239008257,6150,2011,6831383,103,Original tweet,https://t.co/2ATDsgHD4n,People please. This is a Deadly Mediterranean Plop T-Rex. We only rate dogs. Only send in dogs. Thanks you... 11/10 https://t.co/2ATDsgHD4n,11.0,10.0,a,False,False,False,False,2016,4,6
717428917016076293,1708,497,6831383,103,Original tweet,https://t.co/6WTfJvtKx6,This is Skittle. He's trying to communicate. 11/10 solid effort https://t.co/6WTfJvtKx6,11.0,10.0,Skittle,False,False,False,False,2016,4,5
717421804990701568,3368,923,6831383,103,Original tweet,https://t.co/LBJqxMGaHi,This is Ebby. She's a Zimbabwean Feta. Embarrassed by ridiculously squishy face. 9/10 would squeeze softly https://t.co/LBJqxMGaHi,9.0,10.0,Ebby,False,False,False,False,2016,4,5
717047459982213120,6681,2080,6831383,103,Original tweet,https://t.co/fGgleFiBPq,This is FlÃ¡vio (pronounced Baxter). He's a Benesnoop Cumberdog. Super rare. Symmetrical. 12/10 would pet so well https://t.co/fGgleFiBPq,12.0,10.0,FlÃ¡vio,False,False,False,False,2016,4,4
717009362452090881,3491,1069,6831383,103,Original tweet,https://t.co/JmgF4dMpw0,This is Smokey. He's having some sort of existential crisis. 10/10 hang in there pupper https://t.co/JmgF4dMpw0,10.0,10.0,Smokey,False,False,True,False,2016,4,4
716802964044845056,4549,1279,6831383,103,Original tweet,https://t.co/SbX4e6Yg3o,This is Link. He struggles with couches. 10/10 would assist https://t.co/SbX4e6Yg3o,10.0,10.0,Link,False,False,False,False,2016,4,4
716791146589110272,5901,1516,6831383,103,Original tweet,https://t.co/h0trcJohYO,Meet Jennifur. She's supposed to be navigating. Not even buckled up. Insubordinate &amp; churlish. 11/10 would still pet https://t.co/h0trcJohYO,11.0,10.0,Jennifur,False,False,False,False,2016,4,4
716730379797970944,1309,460,6831383,103,Original tweet,https://t.co/Juid3nnLbC,"There has clearly been a mistake. Pup did nothing wrong. 12/10 would help escape
https://t.co/Juid3nnLbC",12.0,10.0,None,False,False,False,False,2016,4,3
716447146686459905,13999,6422,6831383,103,Original tweet,https://t.co/gHWsCTu90E,This is Ozzy. He's acrobatic af. Legendary pupper status achieved. 13/10 https://t.co/gHWsCTu90E,13.0,10.0,Ozzy,False,False,True,False,2016,4,3
716439118184652801,2518,240,6831383,103,Original tweet,https://t.co/Kky1DPG4iq,This is Bluebert. He just saw that both #FinalFur match ups are split 50/50. Amazed af. 11/10 https://t.co/Kky1DPG4iq,50.0,50.0,Bluebert,False,False,False,False,2016,4,3
716285507865542656,2968,1191,6831383,103,Original tweet,https://t.co/WIWabMngQZ,This is Stephanus. She stays woke. 12/10 https://t.co/WIWabMngQZ,12.0,10.0,Stephanus,False,False,False,False,2016,4,2
716080869887381504,5215,1900,6831383,103,Original tweet,https://t.co/UACnoyi8zu,Here's a super majestic doggo and a sunset 11/10 https://t.co/UACnoyi8zu,11.0,10.0,None,True,False,False,False,2016,4,2
715928423106027520,3417,957,6831383,103,Original tweet,https://t.co/3BhMojONxq,This is Bubbles. He's a Yorkshire Piccolope. 11/10 would snug aggressively https://t.co/3BhMojONxq,11.0,10.0,Bubbles,False,False,False,False,2016,4,1
715758151270801409,3985,1555,6831383,103,Original tweet,https://t.co/wJX74TSgzP,This is old now but it's absolutely heckin fantastic and I can't not share it with you all. 13/10  https://t.co/wJX74TSgzP,13.0,10.0,old,False,False,False,False,2016,4,1
715733265223708672,4976,1855,6831383,103,Original tweet,https://t.co/cxl6xGY8B9,This is a taco. We only rate dogs. Please only send in dogs. Dogs are what we rate. Not tacos. Thank you... 10/10 https://t.co/cxl6xGY8B9,10.0,10.0,a,False,False,False,False,2016,4,1
715704790270025728,2991,617,6831383,103,Original tweet,https://t.co/9PnKkKzoUp,This is Bentley. He gives kisses back. 11/10 precious af (vid by @emmaallen25) https://t.co/9PnKkKzoUp,11.0,10.0,Bentley,False,False,False,False,2016,4,1
715696743237730304,4163,1410,6831383,103,Original tweet,https://t.co/cYPHuJYTjC,Meet Toby. He's a Lithuanian High-Steppin Stickeroo. One of the more accomplished Stickeroos around. 10/10 so nifty https://t.co/cYPHuJYTjC,10.0,10.0,Toby,False,False,False,False,2016,4,1
715680795826982913,4611,1772,6831383,103,Original tweet,https://t.co/sSugyyRuTp,This is Zeus. He's downright fabulous. 12/10 https://t.co/sSugyyRuTp,12.0,10.0,Zeus,False,False,False,False,2016,3,31
715360349751484417,5840,1717,6831383,103,Original tweet,https://t.co/hwv7Wq6gDA,This is Bertson. He just wants to say hi. 11/10 would boop nose https://t.co/hwv7Wq6gDA,11.0,10.0,Bertson,False,False,False,False,2016,3,31
715342466308784130,3222,747,6831383,103,Original tweet,https://t.co/vSufMAKm3C,This is Oscar. He's a world renowned snowball inspector. It's a ruff job but someone has to do it. 10/10 great guy https://t.co/vSufMAKm3C,10.0,10.0,Oscar,False,False,False,False,2016,3,31
715220193576927233,2571,716,6831383,103,Original tweet,https://t.co/1OBdJkMOFx,This is Nico. His selfie game is strong af. Excellent use of a sneaky tongue slip. 10/10 star material https://t.co/1OBdJkMOFx,10.0,10.0,Nico,False,False,False,False,2016,3,30
715200624753819648,5466,2057,6831174,103,Original tweet,https://t.co/tvVDY0G911,This is Michelangelope. He's half coffee cup. Rare af. 12/10 would hug until someone stopped me https://t.co/tvVDY0G911,12.0,10.0,Michelangelope,False,False,False,False,2016,3,30
715009755312439296,4449,1352,6831383,103,Original tweet,https://t.co/TjnI33RE1i,This is Siba. She's remarkably mobile. Very sleepy as well. 12/10 would happily transport https://t.co/TjnI33RE1i,12.0,10.0,Siba,False,False,False,False,2016,3,30
714982300363173890,4006,1131,6831383,103,Original tweet,https://t.co/jRm5J3YCmj,This is Calbert. He forgot to clear his Google search history. 9/10 rookie mistake Calbert https://t.co/jRm5J3YCmj,9.0,10.0,Calbert,False,False,False,False,2016,3,30
714962719905021952,7854,4672,6831383,103,Original tweet,https://t.co/T9sgP9ttnQ,Just in case anyone's having a bad day. 12/10 would bounce with https://t.co/T9sgP9ttnQ,12.0,10.0,None,False,False,False,False,2016,3,29
714957620017307648,4412,1550,6831383,103,Original tweet,https://t.co/s8YcfZrWhK,This is Curtis. He's an Albino Haberdasher. Terrified of dandelions. They really spook him up. 10/10 it'll be ok pup https://t.co/s8YcfZrWhK,10.0,10.0,Curtis,False,False,False,False,2016,3,29
714631576617938945,3486,1091,6831383,103,Original tweet,https://t.co/3oeFfHjv0Z,This is Benedict. He's a feisty pup. Needs a brushing. Portable af. Looks very angry actually. 4/10 might not pet https://t.co/3oeFfHjv0Z,4.0,10.0,Benedict,False,False,False,False,2016,3,29
714606013974974464,3861,1017,6831383,103,Original tweet,https://t.co/zO4eb7C4tG,Here are two lil cuddly puppers. Both 12/10 would snug like so much https://t.co/zO4eb7C4tG,12.0,10.0,None,False,False,False,False,2016,3,29
714485234495041536,2894,1272,6831383,103,Original tweet,https://t.co/MfW2aym5UF,This is Blitz. He screams. 10/10 (vid by @yeaahliv) https://t.co/MfW2aym5UF,10.0,10.0,Blitz,False,False,False,False,2016,3,28
714258258790387713,3210,783,6831383,103,Original tweet,https://t.co/Akzl5ynMmE,"Meet Travis and Flurp. Travis is pretty chill but Flurp can't lie down properly. 10/10 &amp; 8/10
get it together Flurp https://t.co/Akzl5ynMmE",10.0,10.0,Travis,False,False,False,False,2016,3,28
714251586676113411,3488,918,6831383,103,Original tweet,https://t.co/rDVueNIcEi,This is Thumas. He hates potted plants. 8/10 wtf Thumas https://t.co/rDVueNIcEi,8.0,10.0,Thumas,False,False,False,False,2016,3,28
714214115368108032,2423,961,6831382,103,Original tweet,https://t.co/YMx4KWJUAB,Happy Easter from the squad! ðŸ‡ðŸ¶ 13/10 for all https://t.co/YMx4KWJUAB,13.0,10.0,None,False,False,False,False,2016,3,27
714141408463036416,4584,1530,6831383,103,Original tweet,https://t.co/O2RlKXigHu,"I know we only rate dogs, but since it's Easter I guess we could rate a bunny for a change. 10/10 petable as hell https://t.co/O2RlKXigHu",10.0,10.0,None,False,False,False,False,2016,3,27
713919462244790272,3487,850,6831383,103,Original tweet,https://t.co/7vyAzIURrE,This is Kanu. He's a Freckled Ticonderoga. Simply flawless. 12/10 would perform an elaborate heist to capture https://t.co/7vyAzIURrE,12.0,10.0,Kanu,False,False,False,False,2016,3,27
713909862279876608,2039,598,6831383,103,Original tweet,https://t.co/7IWKfbfihS,This is Doug. His nose is legendary af. 12/10 (vid by @probably_trey) https://t.co/7IWKfbfihS,12.0,10.0,Doug,False,False,False,False,2016,3,27
713900603437621249,3017,811,6831383,103,Original tweet,https://t.co/mpvaVxKmc1,Happy Saturday here's 9 puppers on a bench. 99/90 good work everybody https://t.co/mpvaVxKmc1,99.0,90.0,None,False,False,False,False,2016,3,27
713761197720473600,5196,1500,6831383,103,Original tweet,https://t.co/QP6GHi5az9,This is Piper. She would really like that tennis ball core. Super sneaky tongue slip. 12/10 precious af https://t.co/QP6GHi5az9,12.0,10.0,Piper,False,False,False,False,2016,3,26
713411074226274305,4705,1410,6831383,103,Original tweet,https://t.co/jVJJKlPbvq,Here we see an extremely rare Bearded Floofmallow. Only a few left in the wild. 11/10 would pet with a purpose https://t.co/jVJJKlPbvq,11.0,10.0,None,False,False,False,False,2016,3,25
713177543487135744,7686,3102,6831383,103,Original tweet,https://t.co/SqnG9Ap28J,This is Lance. Lance doesn't give a shit. 10/10 we should all be more like Lance https://t.co/SqnG9Ap28J,10.0,10.0,Lance,False,False,False,False,2016,3,25
713175907180089344,4757,1589,6831383,103,Original tweet,https://t.co/xT7XaY4gnW,Say hello to Opie and Clarkus. Clarkus fell asleep so Opie buried him. Ruthless af 10/10 for both https://t.co/xT7XaY4gnW,10.0,10.0,Opie,False,False,False,False,2016,3,25
712809025985978368,19881,7361,6831383,103,Original tweet,https://t.co/HVGs5aAKAn,This is Stubert. He just arrived. 10/10 https://t.co/HVGs5aAKAn,10.0,10.0,Stubert,False,False,False,False,2016,3,24
712717840512598017,13199,5452,6831383,103,Original tweet,https://t.co/83RGhdIQz2,Please don't send in any more polar bears. We only rate dogs. Thank you... 10/10 https://t.co/83RGhdIQz2,10.0,10.0,None,False,False,False,False,2016,3,23
712668654853337088,4443,1328,6831383,103,Original tweet,https://t.co/88aedAmxcl,Say hello to Sunny and Roxy. They pull things out of water together. 10/10 for both https://t.co/88aedAmxcl,10.0,10.0,Sunny,False,False,False,False,2016,3,23
712438159032893441,5676,1705,6831383,103,Original tweet,https://t.co/7zjEC501Ul,This is Kane. He's a semi-submerged Haitian Huffleplop. Happy af. Sick waterfall. 11/10 would pat head approvingly https://t.co/7zjEC501Ul,11.0,10.0,Kane,False,False,False,False,2016,3,23
712309440758808576,261,25,6831383,103,Original tweet,https://t.co/kJIMNyMNKV,"Reminder that we made our first set of stickers available! All are 12/10 would stick
Use code ""pupper"" at checkoutðŸ¶

https://t.co/kJIMNyMNKV",12.0,10.0,None,False,False,True,False,2016,3,22
712097430750289920,4053,1135,6831383,103,Original tweet,https://t.co/8AGcQ4hIfK,I can't even comprehend how confused this dog must be right now. 10/10 https://t.co/8AGcQ4hIfK,10.0,10.0,None,False,False,False,False,2016,3,22
712092745624633345,3142,985,6831383,103,Original tweet,https://t.co/tA0ZiQ7JcG,This is Steven. He's inverted af. Also very helpful. Scans anything you want for free. Takes him a while tho. 7/10 https://t.co/tA0ZiQ7JcG,7.0,10.0,Steven,False,False,False,False,2016,3,22
712085617388212225,3451,533,6831383,103,Original tweet,https://t.co/yagmFdKlyL,"Say hello to Olive and Ruby. They are best buddies. Both 11/10 
1 like = 1 buddy https://t.co/yagmFdKlyL",11.0,10.0,Olive,False,False,False,False,2016,3,22
712065007010385924,2414,686,6831383,103,Original tweet,https://t.co/o2GvskrhHt,This is Chester. He's clearly in charge of the other dogs. Weird ass paws. Not fit for fetch. 6/10 would still pet https://t.co/o2GvskrhHt,6.0,10.0,Chester,False,False,False,False,2016,3,21
711968124745228288,8596,2523,6831383,103,Original tweet,https://t.co/2e6cUtKUuc,Meet Winston. He's trapped in a cup of coffee. Poor pupper. 10/10 someone free him https://t.co/2e6cUtKUuc,10.0,10.0,Winston,False,False,True,False,2016,3,21
711743778164514816,3031,1076,6831383,103,Original tweet,https://t.co/QcSIRDpfVg,Meet Roosevelt. He's calculating the best case scenario if he drops out instead of doing math hw. 11/10 relatable af https://t.co/QcSIRDpfVg,11.0,10.0,Roosevelt,False,False,False,False,2016,3,21
711732680602345472,9515,4512,6831383,103,Original tweet,https://t.co/1KiuZqqOD4,I want to hear the joke this dog was just told. 10/10 https://t.co/1KiuZqqOD4,10.0,10.0,None,False,False,False,False,2016,3,21
711694788429553666,35105,19944,6831383,103,Original tweet,https://t.co/Ezu6jQrKAZ,Oh. My. God. 13/10 magical af https://t.co/Ezu6jQrKAZ,13.0,10.0,None,False,False,False,False,2016,3,20
711652651650457602,4129,1001,6831383,103,Original tweet,https://t.co/Sk3CbhmKSW,This is Gary. He just wanted to say hi. 9/10 very personable pup https://t.co/Sk3CbhmKSW,9.0,10.0,Gary,False,False,False,False,2016,3,20
711363825979756544,3909,1245,6831383,103,Original tweet,https://t.co/nJIXSPfedK,"""Please, no puparazzi"" 11/10 https://t.co/nJIXSPfedK",11.0,10.0,None,False,False,False,False,2016,3,20
711306686208872448,3528,797,6831383,103,Original tweet,https://t.co/wcwoGOkZvz,What hooligan sent in pictures w/out a dog in them? Churlish af. 3/10 just bc that's a neat fluffy bean bag chair https://t.co/wcwoGOkZvz,3.0,10.0,None,False,False,False,False,2016,3,19
711008018775851008,3198,685,6831383,103,Original tweet,https://t.co/68iNM7B5gW,This is Chuckles. He had a balloon but he accidentally let go of it and it floated away. 11/10 hang in there pupper https://t.co/68iNM7B5gW,11.0,10.0,Chuckles,False,False,True,False,2016,3,19
710997087345876993,4858,1518,6831383,103,Original tweet,https://t.co/Mv37BHEyyD,Meet Milo and Amos. They are the best of pals. Both 12/10 would pet at the same time https://t.co/Mv37BHEyyD,12.0,10.0,Milo,False,False,False,False,2016,3,19
710844581445812225,2724,749,6831383,103,Original tweet,https://t.co/UgkTw7TKyM,This is Staniel. His selfie game is strong af. 10/10 I'd snapchat with Staniel https://t.co/UgkTw7TKyM,10.0,10.0,Staniel,False,False,False,False,2016,3,18
710833117892898816,2877,587,6831383,103,Original tweet,https://t.co/PmTR4kxZkq,Say hello to Sora. She's an Egyptian Pumpernickel. Mesmerizing af. 12/10 would bring home to mom https://t.co/PmTR4kxZkq,12.0,10.0,Sora,False,False,False,False,2016,3,18
710658690886586372,2465,617,6831383,103,Original tweet,https://t.co/0eb7R1Om12,Here's a brigade of puppers. All look very prepared for whatever happens next. 80/80 https://t.co/0eb7R1Om12,80.0,80.0,None,False,False,False,False,2016,3,18
710609963652087808,5127,2564,6831383,103,Original tweet,https://t.co/DU7Rb3NDiy,I've watched this a million times and you probably will too. 12/10 (vid by @emily_galasso) https://t.co/DU7Rb3NDiy,12.0,10.0,None,False,False,False,False,2016,3,17
710588934686908417,4869,2052,6831383,103,Original tweet,https://t.co/kzMVMU8HBV,This is Beemo. He's a Chubberflop mix. 12/10 would cross the world for https://t.co/kzMVMU8HBV,12.0,10.0,Beemo,False,False,False,False,2016,3,17
710296729921429505,2530,804,6831383,103,Original tweet,https://t.co/VmtzwAuotq,This is Oshie. 12/10 please enjoy (vid by @catherinec1389) https://t.co/VmtzwAuotq,12.0,10.0,Oshie,False,False,False,False,2016,3,17
710283270106132480,2275,564,6831383,103,Original tweet,https://t.co/ONuBILIYXZ,This is Gunner. He's a Figamus Newton. King of the peek-a-boo. Cool jeans. 11/10 https://t.co/ONuBILIYXZ,11.0,10.0,Gunner,False,False,False,False,2016,3,17
710272297844797440,4832,1378,6831383,103,Original tweet,https://t.co/odfLzBonG2,We ðŸ‘ðŸ» only ðŸ‘ðŸ» rate ðŸ‘ðŸ» dogs. Pls stop sending in non-canines like this Dutch Panda Worm. This is infuriating. 11/10 https://t.co/odfLzBonG2,11.0,10.0,infuriating,False,False,False,False,2016,3,17
710269109699739648,2563,1228,6831383,103,Original tweet,https://t.co/OcCDb2bng5,"The squad is back for St. Patrick's Day! â˜˜ ðŸ’š
13/10 for all https://t.co/OcCDb2bng5",13.0,10.0,None,False,False,False,False,2016,3,17
710153181850935296,3102,971,6831383,103,Original tweet,https://t.co/fG5Pk3Et1I,This is Lacy. She's tipping her hat to you. Daydreams of her life back on the frontier. 11/10 would pet so well https://t.co/fG5Pk3Et1I,11.0,10.0,Lacy,False,False,False,False,2016,3,16
710140971284037632,2956,977,6831383,103,Original tweet,https://t.co/nLuPY3pY12,This is Tater. His underbite is fierce af. Doesn't give a damn about your engagement photo. 8/10 https://t.co/nLuPY3pY12,8.0,10.0,Tater,False,False,False,False,2016,3,16
710117014656950272,5870,2177,6831383,103,Original tweet,https://t.co/h1OX2mLtxV,This pupper got her hair chalked for her birthday. Hasn't told her parents yet. Rebellious af. 11/10 very nifty https://t.co/h1OX2mLtxV,11.0,10.0,None,False,False,True,False,2016,3,16
709918798883774466,3184,1173,6831383,103,Original tweet,https://t.co/R1gLc5vDqG,Meet Watson. He's a Suzuki Tickleboop. Leader of a notorious biker gang. Only one ear functional. 12/10 snuggable af https://t.co/R1gLc5vDqG,12.0,10.0,Watson,False,False,False,False,2016,3,16
709901256215666688,719,109,6831383,103,Original tweet,https://t.co/k5xsufRKYm https://t.co/ShXk46V13r,"WeRateDogs stickers are here and they're 12/10! Use code ""puppers"" at checkout ðŸ¶ðŸ¾

Shop now: https://t.co/k5xsufRKYm https://t.co/ShXk46V13r",12.0,10.0,None,False,False,False,False,2016,3,16
709852847387627521,3747,1302,6831383,103,Original tweet,https://t.co/BNdVZEHRow,*lets out a tiny whimper and then collapses* ...12/10 https://t.co/BNdVZEHRow,12.0,10.0,None,False,False,False,False,2016,3,15
709566166965075968,3771,1320,6831383,103,Original tweet,https://t.co/E9jaU59bh9,This is Olaf. He's gotta be rare. Seems sturdy. Tail is floofy af. 12/10 would do whatever it takes to pet https://t.co/E9jaU59bh9,12.0,10.0,Olaf,False,False,False,False,2016,3,15
709556954897764353,3506,1164,6831383,103,Original tweet,https://t.co/ijJB0DuOIC,This is Cecil. She's a Gigglefloof Poofer. Outdoorsy af. One with nature. 12/10 would strategically capture https://t.co/ijJB0DuOIC,12.0,10.0,Cecil,False,False,False,False,2016,3,15
709519240576036864,1588,263,6831383,103,Original tweet,https://t.co/aczGAV2dK4,This is Vince. He's a Gregorian Flapjeck. White spot on legs almost looks like another dog (whoa). 9/10 rad as hell https://t.co/aczGAV2dK4,9.0,10.0,Vince,False,False,False,False,2016,3,14
709449600415961088,2375,646,6831383,103,Original tweet,https://t.co/c6af6nYEPo,Meet Karma. She's just a head. Lost body during the Second Punic War (unfortunate). Loves to travel 10/10 petable af https://t.co/c6af6nYEPo,10.0,10.0,Karma,False,False,False,False,2016,3,14
709409458133323776,2797,763,6831383,103,Original tweet,https://t.co/Yu0K98VZ9A,This is Billy. He sensed a squirrel. 8/10 damn it Billy https://t.co/Yu0K98VZ9A,8.0,10.0,Billy,False,False,False,False,2016,3,14
709225125749587968,2561,627,6831383,103,Original tweet,https://t.co/k6fEWHSALn,This is Walker. He's a Butternut Khalifa. Appears fuzzy af. 11/10 would hug for a ridiculous amount of time https://t.co/k6fEWHSALn,11.0,10.0,Walker,False,False,False,False,2016,3,14
709207347839836162,13465,6380,6831383,103,Original tweet,https://t.co/qcZDZGCapg,This is Penny. She's trying on her prom dress. Stunning af 11/10 https://t.co/qcZDZGCapg,11.0,10.0,Penny,False,False,False,False,2016,3,14
709198395643068416,2573,699,6831383,103,Original tweet,https://t.co/sedre1ivTK,"From left to right:
Cletus, Jerome, Alejandro, Burp, &amp; Titson
None know where camera is. 45/50 would hug all at once https://t.co/sedre1ivTK",45.0,50.0,None,False,False,False,False,2016,3,14
709179584944730112,2150,736,6831383,103,Original tweet,https://t.co/CLe9ETEjeF,This is Sammy. He's in a tree. Very excited about it. 13/10 https://t.co/CLe9ETEjeF,13.0,10.0,Sammy,False,False,False,False,2016,3,14
709158332880297985,2188,454,6831383,103,Original tweet,https://t.co/FjAj3ggXrR,Meet Rodney. He's a Ukranian Boomchicka. Outside but would like to be inside. Only has one ear (unfortunate) 10/10 https://t.co/FjAj3ggXrR,10.0,10.0,Rodney,False,False,False,False,2016,3,13
709042156699303936,5091,1801,6831383,103,Original tweet,https://t.co/7BkkVNu5pd,This is Klevin. He's addicted to sandwiches (yes a hotdog is a sandwich fight me) It's tearing his family apart 9/10 https://t.co/7BkkVNu5pd,9.0,10.0,Klevin,False,False,False,False,2016,3,13
708853462201716736,1911,718,6831383,103,Original tweet,https://t.co/RXjEwpVJf0,This is Lucy. She doesn't understand fetch. 8/10 try turning off and back on (vid by @rileyyoungblood) https://t.co/RXjEwpVJf0,8.0,10.0,Lucy,False,False,False,False,2016,3,13
708845821941387268,3169,981,6831383,103,Original tweet,https://t.co/5DLJB4ssvI,Here's a pupper with magic eyes. Not wearing a seat belt tho (irresponsible af). Very distracting to driver. 9/10 https://t.co/5DLJB4ssvI,9.0,10.0,None,False,False,True,False,2016,3,13
708834316713893888,1822,550,6831383,103,Original tweet,https://t.co/Vd2FqHIIGn,Meet Malikai. He was rolling around having fun when he remembered the inevitable heat death of the universe. 10/10 https://t.co/Vd2FqHIIGn,10.0,10.0,Malikai,False,False,False,False,2016,3,13
708810915978854401,17648,7618,6831384,103,Original tweet,https://t.co/2KcuJXL2r4,This is Mister. He's a wonderful father to his two pups. Heartwarming af. 10/10 for all https://t.co/2KcuJXL2r4,10.0,10.0,Mister,False,False,False,False,2016,3,13
708738143638450176,2928,887,6831384,103,Original tweet,https://t.co/wsCB6LFNxD,This is Coco. She gets to stay on the Bachelor for another week. Super pumped 11/10 https://t.co/wsCB6LFNxD,11.0,10.0,Coco,False,False,False,False,2016,3,12
708711088997666817,2727,797,6831384,103,Original tweet,https://t.co/Ah7WlYTUBQ,This is Smokey. He really likes tennis balls. 11/10 https://t.co/Ah7WlYTUBQ,11.0,10.0,Smokey,False,False,False,False,2016,3,12
708479650088034305,2720,741,6831384,103,Original tweet,https://t.co/uC8kUqAz0W,Meet Bear. He's a Beneboop Cumberclap. Extremely unamused. 13/10 I'm in love with this picture https://t.co/uC8kUqAz0W,13.0,10.0,Bear,False,False,False,False,2016,3,12
708469915515297792,3285,894,6831384,103,Original tweet,https://t.co/VwDc6PTDzk,This is Bobble. He's a Croatian Galifianakis. Hears everything within 400 miles. 11/10 would snug diligently https://t.co/VwDc6PTDzk,11.0,10.0,Bobble,False,False,False,False,2016,3,12
708400866336894977,17124,11054,6831384,103,Original tweet,https://t.co/xdNNEZdGJY,RT if you are as ready for summer as this pup is 12/10 https://t.co/xdNNEZdGJY,12.0,10.0,None,False,False,False,False,2016,3,11
708356463048204288,3852,1473,6831384,103,Original tweet,https://t.co/oSuEGw0BhX,This is Oliver. That is his castle. He protects it with his life. He's also squishy af. 10/10 would squish softly https://t.co/oSuEGw0BhX,10.0,10.0,Oliver,False,False,False,False,2016,3,11
